{
  "$schema": "./dev-plan.schema.json",
  "meta": {
    "project": "CapCut-like Desktop Video Editor",
    "version": "0.2.0",
    "createdAt": "2026-07-01",
    "updatedAt": "2026-07-02",
    "targetPlatform": "Desktop (Electron + React + TypeScript)",
    "goal": "실제 배포 가능한 데스크톱 영상 편집기 제품",
    "developerLevel": "intermediate",
    "coreFeatures": [
      "타임라인 컷 편집",
      "자막/텍스트",
      "오디오/배경음악",
      "효과/전환/필터"
    ],
    "corePrinciple": "프리뷰 엔진(WebCodecs+WebGL, 실시간)과 내보내기 엔진(FFmpeg, 오프라인)을 분리하되, 이펙트/합성 결과는 양쪽이 동일해야 한다(WYSIWYG). WYSIWYG 판정은 정성 비교가 아니라 수치 기준(기준 프레임 SSIM)으로 한다.",
    "revisionNotes": "v0.2.0 (2026-07-02): (1) WebGL 컴포지터를 Phase 4에서 Phase 1.3으로 전진(Canvas2D→WebGL 재작업 제거), (2) 내보내기 파이프라인 스파이크를 Phase 1.5로 전진(WYSIWYG 구조 리스크 조기 검증), (3) 최소 오디오 재생을 1.4(A/V 싱크)에 포함(Phase 2 의존성 역전 해소), (4) 코덱 호환성 fallback을 Phase 0.4로 승격 + VFR 감지를 0.2에 추가, (5) 품질 기준 수치화(SSIM/내보내기 속도), (6) 초기 내보내기 프리셋 H.264+AAC 한정, (7) e2e 스모크(1.6)와 CI 게이트(0.1.6) 추가.",
    "usage": "각 step의 checklist 항목을 완료하면 done=true 로 바꾸고, verification.loop 를 순서대로 실행해 successCriteria 를 모두 만족해야 다음 step 으로 진행한다."
  },

  "techStack": {
    "shell": "Electron",
    "ui": "React + TypeScript",
    "stateManagement": "Zustand + command pattern (undo/redo)",
    "realtimePreview": "WebCodecs API + WebGL (Phase 1부터 WebGL 컴포지터 채택)",
    "effectsCompositing": "WebGL (PixiJS 선택 가능)",
    "audioPreview": "Web Audio API",
    "exportRender": "FFmpeg (bundled binary) + ffprobe",
    "exportRenderHost": "미정 — Phase 1.5 스파이크에서 결정 (숨김 BrowserWindow vs 기존 렌더러 vs UtilityProcess)",
    "audioMixdown": "미정 — Phase 5.1에서 결정 (OfflineAudioContext vs FFmpeg 오디오 필터)",
    "bundler": "Vite",
    "testing": "Vitest (unit) + Playwright (e2e)"
  },

  "progressLegend": {
    "done": "checklist 항목 완료 여부 (true/false)",
    "status": "step 진행 상태: not_started | in_progress | verifying | done | blocked"
  },

  "phases": [
    {
      "id": "phase-0",
      "name": "기반 세팅",
      "goal": "앱 셸을 띄우고 영상 파일을 읽어 첫 프레임을 화면에 그린다. 미지원 코덱/VFR 소스도 호환 프록시로 열 수 있다.",
      "estimate": "2주",
      "status": "not_started",
      "steps": [
        {
          "id": "0.1",
          "name": "프로젝트 스캐폴딩",
          "description": "Electron + React + TS + Vite 보일러플레이트 구성, 메인/렌더러 프로세스 분리.",
          "status": "not_started",
          "checklist": [
            { "id": "0.1.1", "task": "Electron + Vite + React + TS 프로젝트 생성", "done": false },
            { "id": "0.1.2", "task": "메인 프로세스 <-> 렌더러 IPC 통신 채널 셋업", "done": false },
            { "id": "0.1.3", "task": "ESLint + Prettier + tsconfig strict 설정", "done": false },
            { "id": "0.1.4", "task": "Vitest + Playwright 테스트 러너 설정", "done": false },
            { "id": "0.1.5", "task": "Git 저장소 + .gitignore + 기본 README 커밋", "done": false },
            { "id": "0.1.6", "task": "CI 파이프라인 셋업(빌드 + 테스트 + plan:validate 게이트)", "done": false }
          ],
          "verification": {
            "loop": [
              "npm run dev 로 앱을 실행한다",
              "빈 창이 뜨는지 확인한다",
              "렌더러에서 IPC로 메인에 ping 을 보내고 pong 응답을 콘솔에서 확인한다",
              "npm run test 로 샘플 테스트가 통과하는지 확인한다",
              "CI에서 빌드+테스트+plan:validate 가 자동 실행되는지 확인한다"
            ],
            "successCriteria": [
              "앱 창이 에러 없이 뜬다",
              "IPC ping/pong 왕복이 동작한다",
              "빌드(npm run build)가 성공한다",
              "CI 게이트가 동작한다"
            ],
            "onFailure": "IPC 실패 시 contextBridge/preload 설정 점검, 빌드 실패 시 vite electron 플러그인 버전 호환 확인"
          }
        },
        {
          "id": "0.2",
          "name": "FFmpeg 번들링 + 미디어 프로브",
          "description": "FFmpeg/ffprobe 바이너리를 앱에 번들하고 메인 프로세스에서 실행 가능하게 한다. 프로브 단계에서 코덱 지원 여부와 VFR 여부까지 판별한다.",
          "status": "not_started",
          "checklist": [
            { "id": "0.2.1", "task": "플랫폼별 ffmpeg/ffprobe 바이너리 번들 및 경로 해석", "done": false },
            { "id": "0.2.2", "task": "메인 프로세스에서 ffprobe로 파일 메타데이터(코덱/해상도/fps/duration) 추출", "done": false },
            { "id": "0.2.3", "task": "IPC로 렌더러에 메타데이터 전달하는 API 작성", "done": false },
            { "id": "0.2.4", "task": "가변 프레임레이트(VFR) 여부 감지 + WebCodecs 디코딩 지원 여부 판별(코덱별)", "done": false }
          ],
          "verification": {
            "loop": [
              "테스트용 mp4 파일 경로를 넘겨 ffprobe 실행",
              "반환된 JSON에서 width/height/fps/duration 값을 로그로 확인",
              "VFR 소스(스마트폰 촬영본)를 넣어 VFR로 판별되는지 확인",
              "손상된/비디오 아닌 파일을 넣어 에러가 graceful 하게 처리되는지 확인"
            ],
            "successCriteria": [
              "정상 파일에서 정확한 메타데이터가 반환된다",
              "VFR/미지원 코덱 여부가 프로브 결과에 포함된다",
              "잘못된 파일에서 앱이 크래시하지 않고 에러 메시지를 반환한다"
            ],
            "onFailure": "바이너리 실행 권한(chmod +x on mac/linux), asar unpack 설정 확인. VFR 판별은 r_frame_rate vs avg_frame_rate 비교로"
          }
        },
        {
          "id": "0.3",
          "name": "파일 임포트 + 첫 프레임 렌더",
          "description": "파일 다이얼로그로 영상을 불러와 WebCodecs로 첫 프레임을 캔버스에 그린다. (임시 Canvas2D 렌더 — Phase 1.3에서 WebGL 컴포지터로 대체)",
          "status": "not_started",
          "checklist": [
            { "id": "0.3.1", "task": "파일 열기 다이얼로그 + 드래그앤드롭 임포트", "done": false },
            { "id": "0.3.2", "task": "MP4 demux 라이브러리 선정(mp4box.js 등 스파이크) + WebCodecs VideoDecoder 초기화", "done": false },
            { "id": "0.3.3", "task": "첫 키프레임 디코딩 후 canvas에 drawImage", "done": false },
            { "id": "0.3.4", "task": "썸네일 생성 유틸(특정 timestamp 프레임 추출)", "done": false }
          ],
          "verification": {
            "loop": [
              "영상 파일을 임포트한다",
              "캔버스에 첫 프레임 이미지가 표시되는지 눈으로 확인",
              "원본 영상 첫 프레임과 색/구도가 일치하는지 비교",
              "여러 코덱(H.264/H.265) 파일로 반복 테스트"
            ],
            "successCriteria": [
              "임포트한 영상의 첫 프레임이 왜곡 없이 캔버스에 표시된다",
              "H.264 파일에서 정상 동작한다",
              "demux 라이브러리 선정이 확정되어 TECH-STACK.md에 기록된다"
            ],
            "onFailure": "WebCodecs 미지원 코덱은 0.4 fallback 경로로 넘긴다, VideoDecoder config 확인"
          }
        },
        {
          "id": "0.4",
          "name": "코덱 호환성 fallback(호환 프록시)",
          "description": "WebCodecs로 디코딩할 수 없는 코덱(예: Windows HEVC)과 VFR 소스를 FFmpeg 트랜스코딩으로 호환 프록시(H.264 CFR)를 만들어 열 수 있게 한다. Phase 1 프리뷰가 모든 소스에서 동작하기 위한 전제조건.",
          "status": "not_started",
          "criticalRisk": "이 fallback 없이는 Windows HEVC 등 흔한 소스에서 Phase 1 재생 검증 자체가 불가능하다",
          "checklist": [
            { "id": "0.4.1", "task": "WebCodecs 미지원/디코더 초기화 실패 감지 로직(프로브 결과 + 런타임 실패 처리)", "done": false },
            { "id": "0.4.2", "task": "FFmpeg 트랜스코딩으로 호환 프록시 생성(H.264 + CFR 정규화, VFR 소스 포함)", "done": false },
            { "id": "0.4.3", "task": "프록시 생성 진행률 표시 + MediaAsset.proxyPath 매핑 + 캐시(재생성 방지)", "done": false }
          ],
          "verification": {
            "loop": [
              "WebCodecs 미지원 코덱 파일(또는 강제 fallback 플래그)로 임포트한다",
              "호환 프록시가 자동 생성되고 진행률이 표시되는지 확인",
              "프록시로 첫 프레임이 렌더되는지 확인",
              "VFR 파일이 CFR 프록시로 정규화되어 fps가 고정되는지 ffprobe로 확인",
              "같은 파일 재임포트 시 프록시를 재생성하지 않는지 확인"
            ],
            "successCriteria": [
              "미지원 코덱 파일도 임포트 후 프레임 렌더가 가능하다",
              "VFR 소스가 CFR 프록시로 정규화된다",
              "프록시가 캐시되어 중복 생성되지 않는다"
            ],
            "onFailure": "트랜스코딩 파라미터(GOP 길이, 키프레임 간격) 조정 — 시크 성능에 직결됨. 진행률은 ffmpeg -progress 파이프로"
          }
        }
      ]
    },

    {
      "id": "phase-1",
      "name": "타임라인 + 프리뷰 MVP + 내보내기 스파이크",
      "goal": "클립을 자르고 이어붙여 끊김 없이 재생하고(소리 포함), 컷 편집만 되는 최소 내보내기로 파이프라인 구조를 조기 검증한다.",
      "estimate": "4-6주",
      "status": "not_started",
      "criticalPath": true,
      "steps": [
        {
          "id": "1.1",
          "name": "데이터 모델 + 상태관리",
          "description": "Project/Track/Clip/MediaAsset 불변 데이터 모델과 명령 기반 undo/redo 구현. (DATA-MODEL.md의 전환 의미론/트랙 볼륨/마스터 볼륨 포함)",
          "status": "not_started",
          "checklist": [
            { "id": "1.1.1", "task": "Project/Track/Clip/MediaAsset 타입 정의(TS) — DATA-MODEL.md 준수", "done": false },
            { "id": "1.1.2", "task": "Zustand 스토어 + immutable 업데이트 규칙", "done": false },
            { "id": "1.1.3", "task": "커맨드 패턴(execute/undo) + 히스토리 스택", "done": false },
            { "id": "1.1.4", "task": "프로젝트 JSON 직렬화/역직렬화(save/load)", "done": false },
            { "id": "1.1.5", "task": "불변식(invariants) 검증 유틸 + 개발 모드 assert", "done": false },
            { "id": "1.1.6", "task": "모델 조작 함수 유닛 테스트", "done": false }
          ],
          "verification": {
            "loop": [
              "코드로 클립 추가 -> 이동 -> 삭제를 수행",
              "undo를 연속 호출해 각 단계가 정확히 되돌려지는지 확인",
              "redo로 다시 복원되는지 확인",
              "프로젝트를 save 후 load 했을 때 상태가 동일한지 deep-equal 비교",
              "npm run test 로 모델 유닛테스트 통과 확인"
            ],
            "successCriteria": [
              "undo/redo가 모든 조작에서 정확히 동작",
              "save->load 왕복 후 상태 완전 일치",
              "모델 유닛테스트 100% 통과"
            ],
            "onFailure": "상태 mutation 누수(불변성 위반) 추적, 히스토리 스택 분기 처리 재검토"
          }
        },
        {
          "id": "1.2",
          "name": "타임라인 UI",
          "description": "트랙/클립을 시각화하고 드래그·트림·분할·스냅·줌 조작을 제공한다.",
          "status": "not_started",
          "checklist": [
            { "id": "1.2.1", "task": "타임라인 눈금(시간축) + 줌 인/아웃", "done": false },
            { "id": "1.2.2", "task": "클립 블록 렌더 + 드래그로 위치 이동", "done": false },
            { "id": "1.2.3", "task": "클립 양 끝 드래그로 트림(in/out 조절)", "done": false },
            { "id": "1.2.4", "task": "플레이헤드에서 클립 분할(split)", "done": false },
            { "id": "1.2.5", "task": "스냅(클립 경계/플레이헤드에 자석) + 멀티트랙", "done": false },
            { "id": "1.2.6", "task": "선택/삭제/복사/붙여넣기 단축키", "done": false }
          ],
          "verification": {
            "loop": [
              "클립을 드래그해 위치를 옮긴다 -> 데이터 모델 값이 UI와 일치하는지 확인",
              "클립 끝을 드래그해 트림 -> sourceIn/Out 이 정확히 바뀌는지 확인",
              "플레이헤드에서 split -> 클립이 2개로 정확히 나뉘는지 확인",
              "스냅 동작(경계 근처에서 자석)을 눈으로 확인",
              "각 조작 후 undo가 동작하는지 확인"
            ],
            "successCriteria": [